iri,label,notation,definition,altLabels,broader,narrower,related,scheme
https://linked.data.gov.au/def/borehole-purpose-wa/resource-definition-and-conversion-to-ore-reserves,resource definition and conversion to ore reserves,,Drilling to determine the size and grade of an orebody in order to improve confidence in the Mineral Resource and Ore Reserve classification.,,https://linked.data.gov.au/def/borehole-purpose-wa/mining-development-and-production,,,https://linked.data.gov.au/def/borehole-purpose-wa
https://linked.data.gov.au/def/borehole-purpose-wa/shot-hole,shot hole,,A borehole drilled to insert and detonate an explosive charge to generate ground vibrations. The vibrations are recorded using sensors placed at predetermined locations in the surrounding area.,seismic drilling,https://linked.data.gov.au/def/borehole-purpose-wa/geophysical-investigation,,,https://linked.data.gov.au/def/borehole-purpose-wa
https://linked.data.gov.au/def/borehole-purpose-wa/geophysical-investigation,geophysical investigation,,"A borehole drilled for the examination of subsurface geophysical properties (e.g. gravitational, electrical and magnetic fields, etc.).",,,https://linked.data.gov.au/def/borehole-purpose-wa/shot-hole,,https://linked.data.gov.au/def/borehole-purpose-wa
https://linked.data.gov.au/def/borehole-purpose-wa/sterilization,sterilization,,A borehole drilled to check that there are no minerals of current and potential economic interest located below sites for proposed infrastructure.,sterilisation,https://linked.data.gov.au/def/borehole-purpose-wa/mining-development-and-production,,,https://linked.data.gov.au/def/borehole-purpose-wa
https://linked.data.gov.au/def/borehole-purpose-wa/stratigraphic-geology,stratigraphic (geology),,"A borehole/well drilled variously to: provide geological information in areas of poor outcrop and inadequate drillhole coverage, such as assisting the determination of the lithological intervals and stratigraphy present at a location (e.g. GSQ stratigraphic drilling); permit the collection of pristine samples for biostratigraphic, geochemical, geochronological or other studies; investigate the presence of geological setting(s) favourable for mineralization; and/or evaluate emerging technologies. The concept is similar to 'stratigraphic/structural/research (mineral exploration)', but is distinct in not having a primary economic focus.",stratigraphic drilling,https://linked.data.gov.au/def/borehole-purpose-wa/geological-investigation,,,https://linked.data.gov.au/def/borehole-purpose-wa
https://linked.data.gov.au/def/borehole-purpose-wa/geological-investigation,geological investigation,,"Drilling for the primary purpose of understanding the geological characteristics of the site, such as stratigraphy, structure, and physical or chemical rock properties. These boreholes are generally drilled as part of scientific/technical investigations conducted by government or research organizations.",,,"https://linked.data.gov.au/def/borehole-purpose-wa/stratigraphic-geology|https://linked.data.gov.au/def/borehole-purpose-wa/stratigraphic-research-drilling-geology|https://linked.data.gov.au/def/borehole-purpose-wa/structural-drilling-geology",,https://linked.data.gov.au/def/borehole-purpose-wa
https://linked.data.gov.au/def/borehole-purpose-wa/stratigraphic-research-drilling-geology,stratigraphic/research (geology),,A borehole drilled to determine the lithological and stratigraphic intervals present at a location and/or to evaluate emerging technologies. Typically to enhance geological understanding of an area and/or to investigate the presence of geological setting(s) favourable for mineralization. It is most commonly associated with government drilling programs.,,https://linked.data.gov.au/def/borehole-purpose-wa/geological-investigation,,,https://linked.data.gov.au/def/borehole-purpose-wa
https://linked.data.gov.au/def/borehole-purpose-wa/stratigraphic-research-fluid-energy,stratigraphic/research (fluid energy),STR,"A well drilled primarily with the intention of gathering geological data or to evaluate new technologies. The information may include stratigraphy, temperature gradient, heat flow, reservoir presence and quality.",,https://linked.data.gov.au/def/borehole-purpose-wa/exploration-exploitation-fluid-energy-resources,,,https://linked.data.gov.au/def/borehole-purpose-wa
https://linked.data.gov.au/def/borehole-purpose-wa/stratigraphic-structural-research-mineral-exploration,stratigraphic/structural/research (mineral exploration),,"A borehole drilled to determine the lithological intervals present at a location and their structural and/or stratigraphic relationships. Typically drilled to determine the presence, location and extension of a potential resource, and most commonly associated with early stages of the exploration process. It can be associated with trialling of new drilling or analytical technologies.",,https://linked.data.gov.au/def/borehole-purpose-wa/exploration-minerals-and-basic-raw-materials,,,https://linked.data.gov.au/def/borehole-purpose-wa
https://linked.data.gov.au/def/borehole-purpose-wa/exploration-minerals-and-basic-raw-materials,exploration (minerals and basic raw materials),,Drilling to search for and delineate new sources of economic minerals or basic raw (i.e. construction) materials.,,https://linked.data.gov.au/def/borehole-purpose-wa/exploration-exploitation-minerals-and-basic-raw-materials,https://linked.data.gov.au/def/borehole-purpose-wa/stratigraphic-structural-research-mineral-exploration,,https://linked.data.gov.au/def/borehole-purpose-wa
https://linked.data.gov.au/def/borehole-purpose-wa/structural-drilling-geology,structural (geology),,"A borehole/well drilled to investigate the attitude of strata and structural/tectonic relationships of rock units at a location. Typically to enhance geological understanding of an area and/or to investigate the presence of geological setting(s) favourable for mineralization. Most commonly associated with government drilling programs or early stages of exploration. The concept is similar to 'stratigraphic/structural/research (mineral exploration)', but is distinct in not having a primary economic focus.",,https://linked.data.gov.au/def/borehole-purpose-wa/geological-investigation,,,https://linked.data.gov.au/def/borehole-purpose-wa
https://linked.data.gov.au/def/borehole-purpose-wa/stygofauna-monitoring,stygofauna monitoring,,"A borehole/well drilled to identify the presence of stygofauna and facilitate the monitoring of its biodiversity and overall 'health' parameters. Stygofauna, also known as subterranean aquatic fauna, are aquatic fauna that inhabit the water filled pore spaces, voids, cracks and fissures of most rock types and groundwater systems such as aquifers or underground caves.",,https://linked.data.gov.au/def/borehole-purpose-wa/environmental,,,https://linked.data.gov.au/def/borehole-purpose-wa
https://linked.data.gov.au/def/borehole-purpose-wa/transient-storage-liquids,transient storage - liquids other than water,,"A borehole/well used for the injection or withdrawal of liquid or liquefied hydrocarbons into or out of an underground hydrocarbon storage facility, including salt caverns.",temporary storage,https://linked.data.gov.au/def/borehole-purpose-wa/storage,,,https://linked.data.gov.au/def/borehole-purpose-wa
https://linked.data.gov.au/def/borehole-purpose-wa/uncemented-backfill,uncemented backfill,,"A cased borehole drilled for uncemented geomaterial filling in an underground mine. Uncemented backfill drilling is a method used to backfill underground mine stopes and/or drives to facilitate removal of remnant ore material while retaining geotechnical stability. Uncemented backfills include hydraulic fills, sand fills, aggregate fills and rock fills.","aggregate filling|ballast fill filling|hydraulic filling|rock fill filling|sand fill filling",https://linked.data.gov.au/def/borehole-purpose-wa/service-mining,,,https://linked.data.gov.au/def/borehole-purpose-wa
https://linked.data.gov.au/def/borehole-purpose-wa/unknown,unknown,,The specific purpose for the drilling is unknown (or was not recorded).,,,,,https://linked.data.gov.au/def/borehole-purpose-wa
https://linked.data.gov.au/def/borehole-purpose-wa/ventilation,ventilation,,A borehole drilled to create a ventilation shaft in an underground mine.,,https://linked.data.gov.au/def/borehole-purpose-wa/service-mining,,,https://linked.data.gov.au/def/borehole-purpose-wa
https://linked.data.gov.au/def/borehole-purpose-wa/water-injection-well-fluid-energy,water injection well (fluid energy),,"A well/borehole drilled to force water into the target reservoir, usually to enhance energy fluid recovery.",,https://linked.data.gov.au/def/borehole-purpose-wa/injection-fluid-energy,,,https://linked.data.gov.au/def/borehole-purpose-wa
https://linked.data.gov.au/def/borehole-purpose-wa/water-monitoring-mining,water monitoring (mining),,"A monitoring bore drilled to identify the condition of the groundwater and of the water table at and around a mining site or part thereof (e.g. around open pits, tailings dams and waste dumps). Holes are drilled at intervals and cased with slotted casing, allowing groundwater entry and thus regular checking and sample collection/analysis to determine any variations in the height of the water table, water pressure, water quality, presence of contaminants and salinity.",,https://linked.data.gov.au/def/borehole-purpose-wa/hydrogeology-mining,,,https://linked.data.gov.au/def/borehole-purpose-wa
https://linked.data.gov.au/def/borehole-purpose-wa/water-supply-exploration-mining,water supply (exploration/mining),,"A well drilled to extract water from an aquifer for use in exploration and/or mining operations, e.g. to supply water for dust control.",WSW,https://linked.data.gov.au/def/borehole-purpose-wa/hydrogeology-mining,,,https://linked.data.gov.au/def/borehole-purpose-wa
https://linked.data.gov.au/def/borehole-purpose-wa/water-supply-fluid-energy,water supply (fluid energy),,A well drilled to retrieve water to support petroleum and geothermal operations.,WSW,https://linked.data.gov.au/def/borehole-purpose-wa/service-fluid-energy,,,https://linked.data.gov.au/def/borehole-purpose-wa
https://linked.data.gov.au/def/borehole-purpose-wa/exploration-exploitation-minerals-and-basic-raw-materials,exploration and exploitation of minerals and basic raw materials,MIN,"Drilling to assist in the discovery, identification and extraction of mineral resources or basic raw (i.e. construction) materials, including the assessment of their importance and the evaluation of their economic potential. Mineral resources are inclusive of brine-hosted minerals and solid fossil fuels (e.g. coal).",Exploration and exploitation of mineral resources,,"https://linked.data.gov.au/def/borehole-purpose-wa/mining-development-and-production|https://linked.data.gov.au/def/borehole-purpose-wa/exploration-minerals-and-basic-raw-materials",,https://linked.data.gov.au/def/borehole-purpose-wa