iri,label,notation,definition,altLabels,broader,narrower,related,scheme
https://linked.data.gov.au/def/borehole-purpose-wa/acid-leachate-testing,acid leachate testing,,A well or bore drilled to recover strata samples for their use in acid leachate testing.,,https://linked.data.gov.au/def/borehole-purpose-wa/environmental,,,https://linked.data.gov.au/def/borehole-purpose-wa
https://linked.data.gov.au/def/borehole-purpose-wa/environmental,environmental,,"Environmental drilling is performed when soil, rock or groundwater samples are required to assess an area for contamination, or when groundwater monitoring wells or remediation wells are required for the treatment of groundwater. Typically this type of drilling is conducted for a) testing and monitoring for sites such as landfills or lagoons that have a potential for pollution, b) monitoring and testing of environmentally sensitive sites such as protected lands or public water supply wellfields, c) testing to determine the source and extent of a known pollution problem, d) sampling and well construction for recovery or remediation of pollutants in groundwater, e) identification of product (oil, petrol etc.) or human artefacts (fill, trash, archeological).",,,"https://linked.data.gov.au/def/borehole-purpose-wa/acid-leachate-testing|https://linked.data.gov.au/def/borehole-purpose-wa/materials-characterization|https://linked.data.gov.au/def/borehole-purpose-wa/remediation|https://linked.data.gov.au/def/borehole-purpose-wa/stygofauna-monitoring",,https://linked.data.gov.au/def/borehole-purpose-wa
https://linked.data.gov.au/def/borehole-purpose-wa/appraisal-fluid-energy,appraisal (fluid energy),,"A well drilled into a potential or known fluid energy reservoir to determine the continuation of a known pool and extent of the reservoir, in order to establish the existence of a significant quantity of recoverable fluid energy resource. Note that this concept merges the appraisal and extension definitions of PPDM Well Status and Classification (v3).","petroleum-reservoir-characterisation|petroleum-reservoir-characterization",https://linked.data.gov.au/def/borehole-purpose-wa/exploration-exploitation-fluid-energy-resources,,,https://linked.data.gov.au/def/borehole-purpose-wa
https://linked.data.gov.au/def/borehole-purpose-wa/exploration-exploitation-fluid-energy-resources,exploration and exploitation of fluid energy resources,,"A borehole/well drilled to explore for and exploit naturally occurring fluid energy resources, including petroleum (hydrocarbon) fluids, other natural gases (e.g. hydrogen and helium), and geothermal (naturally heated fluids occurring on or within the Earth's crust).",,,"https://linked.data.gov.au/def/borehole-purpose-wa/appraisal-fluid-energy|https://linked.data.gov.au/def/borehole-purpose-wa/development-fluid-energy|https://linked.data.gov.au/def/borehole-purpose-wa/service-fluid-energy|https://linked.data.gov.au/def/borehole-purpose-wa/exploration-fluid-energy|https://linked.data.gov.au/def/borehole-purpose-wa/injection-fluid-energy|https://linked.data.gov.au/def/borehole-purpose-wa/production-fluid-energy|https://linked.data.gov.au/def/borehole-purpose-wa/production-injection-fluid-energy|https://linked.data.gov.au/def/borehole-purpose-wa/stratigraphic-research-fluid-energy",,https://linked.data.gov.au/def/borehole-purpose-wa
https://linked.data.gov.au/def/borehole-purpose-wa/blasthole,blasthole,,"A well or bore drilled to facilitate the installation and subsequent detonation of explosives, pulverising material and throwing it away from the wall or face, reducing the effort required to advance the face or recover and remove materials.",blast hole,https://linked.data.gov.au/def/borehole-purpose-wa/mining-development-and-production,,,https://linked.data.gov.au/def/borehole-purpose-wa
https://linked.data.gov.au/def/borehole-purpose-wa/mining-development-and-production,mining (development and production),,"A borehole drilled at the surface or underground to develop mines and/or quarries to facilitate production of economic minerals and basic raw materials. It includes drilling for underground services such as cables, water pipes, access and airways.",,https://linked.data.gov.au/def/borehole-purpose-wa/exploration-exploitation-minerals-and-basic-raw-materials,"https://linked.data.gov.au/def/borehole-purpose-wa/blasthole|https://linked.data.gov.au/def/borehole-purpose-wa/service-mining|https://linked.data.gov.au/def/borehole-purpose-wa/hydrogeology-mining|https://linked.data.gov.au/def/borehole-purpose-wa/in-situ-leaching|https://linked.data.gov.au/def/borehole-purpose-wa/grade-control|https://linked.data.gov.au/def/borehole-purpose-wa/metallurgical|https://linked.data.gov.au/def/borehole-purpose-wa/resource-definition-and-conversion-to-ore-reserves|https://linked.data.gov.au/def/borehole-purpose-wa/sterilization",,https://linked.data.gov.au/def/borehole-purpose-wa
https://linked.data.gov.au/def/borehole-purpose-wa/cable-services,cable services,,"A cased borehole drilled for the installation of electric cables, optic fibres and related services in an underground mine.",,https://linked.data.gov.au/def/borehole-purpose-wa/service-mining,,,https://linked.data.gov.au/def/borehole-purpose-wa
https://linked.data.gov.au/def/borehole-purpose-wa/service-mining,service (mining),,"Boreholes drilled to provide services such as the transport of water, compressed air, other gases or materials; placement of electric cables and airlines; or raise bores for access or ventilation. It includes drilling conducted during mine rescue operations.",,https://linked.data.gov.au/def/borehole-purpose-wa/mining-development-and-production,"https://linked.data.gov.au/def/borehole-purpose-wa/cable-services|https://linked.data.gov.au/def/borehole-purpose-wa/drives-and-declines|https://linked.data.gov.au/def/borehole-purpose-wa/paste-fill|https://linked.data.gov.au/def/borehole-purpose-wa/rescue|https://linked.data.gov.au/def/borehole-purpose-wa/uncemented-backfill|https://linked.data.gov.au/def/borehole-purpose-wa/ventilation",,https://linked.data.gov.au/def/borehole-purpose-wa
https://linked.data.gov.au/def/borehole-purpose-wa/development-fluid-energy,development (fluid energy),DEV,"A well/borehole drilled into a known fluid energy source, in order to recover fluid energy resources and generate fluid energy products. This may include service wells.",,https://linked.data.gov.au/def/borehole-purpose-wa/exploration-exploitation-fluid-energy-resources,,,https://linked.data.gov.au/def/borehole-purpose-wa
https://linked.data.gov.au/def/borehole-purpose-wa/dewatering-hydrogeology,dewatering (hydrogeology),,"A borehole drilled to remove water, as a way to facilitate construction or other activity. It is often used as a safety measure in mining below the watertable or as a preliminary step to development in an area.",,https://linked.data.gov.au/def/borehole-purpose-wa/hydrogeology,,,https://linked.data.gov.au/def/borehole-purpose-wa
https://linked.data.gov.au/def/borehole-purpose-wa/hydrogeology,hydrogeology,,"A borehole drilled and completed for the search, abstraction, monitoring and/or disposal/injection of water.",,,"https://linked.data.gov.au/def/borehole-purpose-wa/dewatering-hydrogeology|https://linked.data.gov.au/def/borehole-purpose-wa/disposal-hydrogeology|https://linked.data.gov.au/def/borehole-purpose-wa/groundwater-exploration|https://linked.data.gov.au/def/borehole-purpose-wa/groundwater-monitoring|https://linked.data.gov.au/def/borehole-purpose-wa/groundwater-production|https://linked.data.gov.au/def/borehole-purpose-wa/reinjection-hydrogeology",,https://linked.data.gov.au/def/borehole-purpose-wa
https://linked.data.gov.au/def/borehole-purpose-wa/dewatering-mining,dewatering (mining),,"A borehole drilled and cased to enable the removal of groundwater from a mine. Mine dewatering is critical when a mine extends below the water table and groundwater does, due to gravity, infiltrate the mine workings.",,https://linked.data.gov.au/def/borehole-purpose-wa/hydrogeology-mining,,,https://linked.data.gov.au/def/borehole-purpose-wa
https://linked.data.gov.au/def/borehole-purpose-wa/hydrogeology-mining,hydrogeology (mining),,"Hydrogeology drilling in mining operations is conducted in order to monitor and sample the water table at and around a mining site, retrieve water for use (e.g. for dust control), or to remove water from a mine (dewatering).",,https://linked.data.gov.au/def/borehole-purpose-wa/mining-development-and-production,"https://linked.data.gov.au/def/borehole-purpose-wa/dewatering-mining|https://linked.data.gov.au/def/borehole-purpose-wa/reinjection-mining|https://linked.data.gov.au/def/borehole-purpose-wa/water-monitoring-mining|https://linked.data.gov.au/def/borehole-purpose-wa/water-supply-exploration-mining",,https://linked.data.gov.au/def/borehole-purpose-wa
https://linked.data.gov.au/def/borehole-purpose-wa/disposal-fluid-energy,disposal (fluid energy),,"A well, often a depleted production well, into which waste fluids can be injected into an isolated formation for safe disposal. Disposal wells are typically subject to regulatory requirements to avoid the contamination of freshwater aquifers.",,https://linked.data.gov.au/def/borehole-purpose-wa/service-fluid-energy,,,https://linked.data.gov.au/def/borehole-purpose-wa
https://linked.data.gov.au/def/borehole-purpose-wa/service-fluid-energy,service (fluid energy),,"A well drilled to provide maintenance and monitoring during fluid energy production, which may include supply, disposal, relief, and observation.",,https://linked.data.gov.au/def/borehole-purpose-wa/exploration-exploitation-fluid-energy-resources,"https://linked.data.gov.au/def/borehole-purpose-wa/disposal-fluid-energy|https://linked.data.gov.au/def/borehole-purpose-wa/observation-fluid-energy|https://linked.data.gov.au/def/borehole-purpose-wa/relief-fluid-energy|https://linked.data.gov.au/def/borehole-purpose-wa/water-supply-fluid-energy",,https://linked.data.gov.au/def/borehole-purpose-wa
https://linked.data.gov.au/def/borehole-purpose-wa/disposal-hydrogeology,disposal (hydrogeology),,"A well in which fluids are injected rather than produced, where the primary objective is to dispose of fluid/water into an isolated formation.",,https://linked.data.gov.au/def/borehole-purpose-wa/hydrogeology,,,https://linked.data.gov.au/def/borehole-purpose-wa
https://linked.data.gov.au/def/borehole-purpose-wa/drives-and-declines,drives and declines,,"A borehole drilled to enable construction of underground declines, ore drives and stope access to facilitate mining.",,https://linked.data.gov.au/def/borehole-purpose-wa/service-mining,,,https://linked.data.gov.au/def/borehole-purpose-wa
https://linked.data.gov.au/def/borehole-purpose-wa/electrokinetic-in-situ-leaching,electrokinetic in-situ leaching,,"A borehole drilled for the purpose of electrokinetic in-situ leaching (EK-ISL), an emerging mining technology that allows for the recovery of metals from low-permeability ore bodies via boreholes without excavation or permeability enhancement techniques such as fracking. Instead, it uses electrode wells to generate electric fields and induce the transport of charged chemical species that facilitate the selective dissolution, transport and recovery of targeted metals such as copper or gold.",EK-ISL,https://linked.data.gov.au/def/borehole-purpose-wa/in-situ-leaching,,,https://linked.data.gov.au/def/borehole-purpose-wa
https://linked.data.gov.au/def/borehole-purpose-wa/in-situ-leaching,in-situ leaching,,"A borehole drilled for the purpose of in-situ leaching (ISL, also called in-situ recovery or ISR) or solution mining, a mining process used to recover minerals (e.g. copper and uranium) through boreholes drilled into a deposit. It works by artificially dissolving minerals occurring naturally in a solid state and pumping the pregnant solution to the surface where the minerals can be recovered.","ISL|ISR|in-situ leach",https://linked.data.gov.au/def/borehole-purpose-wa/mining-development-and-production,https://linked.data.gov.au/def/borehole-purpose-wa/electrokinetic-in-situ-leaching,,https://linked.data.gov.au/def/borehole-purpose-wa
https://linked.data.gov.au/def/borehole-purpose-wa/exploration-fluid-energy,exploration (fluid energy),,A well/borehole drilled to determine and evaluate the fluid energy potential of a previously undeveloped area.,"NFW|NPW|New Field Wildcat|New Pool Wildcat|Testing",https://linked.data.gov.au/def/borehole-purpose-wa/exploration-exploitation-fluid-energy-resources,,,https://linked.data.gov.au/def/borehole-purpose-wa
https://linked.data.gov.au/def/borehole-purpose-wa/gas-injection-well-fluid-energy,gas injection well (fluid energy),,"A well/borehole drilled to force gas into the target reservoir, whether to enhance fluid recovery or for temporary/permanent storage.",,https://linked.data.gov.au/def/borehole-purpose-wa/injection-fluid-energy,,,https://linked.data.gov.au/def/borehole-purpose-wa
https://linked.data.gov.au/def/borehole-purpose-wa/injection-fluid-energy,injection (fluid energy),IN,A well drilled to introduce new or return produced fluids from a development or production well back into the subsurface after energy products have been extracted.,,https://linked.data.gov.au/def/borehole-purpose-wa/exploration-exploitation-fluid-energy-resources,"https://linked.data.gov.au/def/borehole-purpose-wa/gas-injection-well-fluid-energy|https://linked.data.gov.au/def/borehole-purpose-wa/water-injection-well-fluid-energy",,https://linked.data.gov.au/def/borehole-purpose-wa
https://linked.data.gov.au/def/borehole-purpose-wa/geotechnical,geotechnical,,"Geotechnical or engineering drilling is carried out to determine soil and rock characteristics in order to facilitate infrastructure and mine planning. It includes the collection of rock and soil samples to determine physical properties (e.g. strength, hardness, fracture and fault frequency) for geotechnical analysis and to identify where unsafe rock or soil conditions could trigger a structural collapse or cause a hazardous scenario during, for example, an earthquake or flooding event. Geotechnical drilling is conducted to assess the potential construction sites of both above and below ground projects, including but not limited to buildings and storage structures, dams, bridges, roads, wharves and other civil works, and below surface projects such as tunnels and shafts (including all open pits and underground mining areas), access or inspection holes, or to facilitate installation of monitoring equipment (e.g. tiltmeters/inclinometers, piezometers and other sensors). Geotechnical work can overlap with environmental drilling on sites where there is a potential for environmental hazards.",engineering drilling,,,,https://linked.data.gov.au/def/borehole-purpose-wa
https://linked.data.gov.au/def/borehole-purpose-wa/grade-control,grade control,,A borehole drilled to estimate grade and location of resources/material in the ground (in-situ) to an acceptable degree of confidence for mining to be economic.,,https://linked.data.gov.au/def/borehole-purpose-wa/mining-development-and-production,,,https://linked.data.gov.au/def/borehole-purpose-wa
https://linked.data.gov.au/def/borehole-purpose-wa/groundwater-exploration,groundwater exploration,,"A borehole drilled to explore the extent and properties of an aquifer and the water quality of groundwater within a given area. Being generally deeper than production or monitoring boreholes, exploration boreholes may also provide geological information on the area under investigation, including stratigraphy, biostratigraphy, lithology and/or structure.",,https://linked.data.gov.au/def/borehole-purpose-wa/hydrogeology,,,https://linked.data.gov.au/def/borehole-purpose-wa
https://linked.data.gov.au/def/borehole-purpose-wa/groundwater-monitoring,groundwater monitoring,,"A borehole drilled to monitor groundwater properties such as levels, quality and production impacts, as a method of assessing changes to the quantity and quality of groundwater (e.g. for piezometer installation). Groundwater data allows for sustainable water extraction and management, and the detection and remediation of groundwater contamination, among other purposes.",,https://linked.data.gov.au/def/borehole-purpose-wa/hydrogeology,,,https://linked.data.gov.au/def/borehole-purpose-wa
https://linked.data.gov.au/def/borehole-purpose-wa/groundwater-production,groundwater production,,"A borehole drilled or altered for the purpose of groundwater abstraction, whether for domestic use, agricultural use or in support of resource infrastructure (e.g. mineral holes, petroleum wells, mines, refineries). Production boreholes are often drilled in sets, known as fields, and can be in close association with exploration and/or monitoring water bores.","water production|water supply",https://linked.data.gov.au/def/borehole-purpose-wa/hydrogeology,,,https://linked.data.gov.au/def/borehole-purpose-wa
https://linked.data.gov.au/def/borehole-purpose-wa/hazard-identification-mapping,hazard identification/mapping,,"An exploratory borehole drilled to identify rock voids, and any other relevant changes in conditions of the earth before drilling, mining, tunnelling or construction commences.",,https://linked.data.gov.au/def/borehole-purpose-wa/foundation-construction,,,https://linked.data.gov.au/def/borehole-purpose-wa
https://linked.data.gov.au/def/borehole-purpose-wa/foundation-construction,foundation/construction,,"Drilling to assess the stability and conditions of rocks in the substrate prior to foundation and construction activities. This drilling aims to differentiate between solid basement and rock detached (floating) from the basement, as well as boring large holes deep into the ground in order to insert structures (e.g. piles, piers, or caissons) that are used to build a foundation for a construction project.",,,https://linked.data.gov.au/def/borehole-purpose-wa/hazard-identification-mapping,,https://linked.data.gov.au/def/borehole-purpose-wa
https://linked.data.gov.au/def/borehole-purpose-wa/in-situ-leaching-storage,in-situ leaching (storage),,"A borehole drilled for the purpose of in-situ leaching (ISL) or solution mining of salt dome structures, specifically to create a cavern suitable for temporary storage of non-aqueous gases. Salt caverns are formed by pumping fresh water to dissolve the salt and removing the resulting brine via a single well, which then serves for gas injection and withdrawal. For storing non-aqueous gases such as hydrogen and carbon dioxide, the caverns are usually at depths of at least a few hundred metres.",ISL,https://linked.data.gov.au/def/borehole-purpose-wa/transient-storage-gases,,,https://linked.data.gov.au/def/borehole-purpose-wa
https://linked.data.gov.au/def/borehole-purpose-wa/transient-storage-gases,transient storage - gases,,A well used to inject and subsequently recover natural gas or other gaseous material (e.g. manufactured hydrogen) into/from subsurface rock formations.,temporary storage,https://linked.data.gov.au/def/borehole-purpose-wa/storage,https://linked.data.gov.au/def/borehole-purpose-wa/in-situ-leaching-storage,,https://linked.data.gov.au/def/borehole-purpose-wa
https://linked.data.gov.au/def/borehole-purpose-wa/managed-aquifer-recharge,managed aquifer recharge,,"A borehole drilled for the intentional recharge of an aquifer under controlled conditions for subsequent recovery, demonstrable environmental benefit, or mitigation of the impacts of abstraction. This recharge must be an additional contribution to an aquifer, not a return of abstracted water.",,https://linked.data.gov.au/def/borehole-purpose-wa/reinjection-hydrogeology,,,https://linked.data.gov.au/def/borehole-purpose-wa
https://linked.data.gov.au/def/borehole-purpose-wa/reinjection-hydrogeology,reinjection (hydrogeology),,A borehole drilled for the purpose of pumping water back into an aquifer.,,https://linked.data.gov.au/def/borehole-purpose-wa/hydrogeology,https://linked.data.gov.au/def/borehole-purpose-wa/managed-aquifer-recharge,,https://linked.data.gov.au/def/borehole-purpose-wa
https://linked.data.gov.au/def/borehole-purpose-wa/materials-characterization,materials characterization,,"A borehole drilled to identify the physical and geochemical properties of materials and whether they have the potential to cause environmental harm and/or contribute to, or detract from, the success of rehabilitation and closure. This drilling focuses on identification of fibrous materials, radioactive materials, materials capable of generating acid and/or metalliferous drainage (including neutral drainage and saline drainage), and dispersive and/or erosive material.",materials characterisation,https://linked.data.gov.au/def/borehole-purpose-wa/environmental,,,https://linked.data.gov.au/def/borehole-purpose-wa
https://linked.data.gov.au/def/borehole-purpose-wa/metallurgical,metallurgical,,"A borehole drilled to obtain samples for metallurgical test work, i.e. to understand the properties of metals and their production and purification.",,https://linked.data.gov.au/def/borehole-purpose-wa/mining-development-and-production,,,https://linked.data.gov.au/def/borehole-purpose-wa
https://linked.data.gov.au/def/borehole-purpose-wa/observation-fluid-energy,observation (fluid energy),,"A service well drilled with the purpose of monitoring the movement of gases and liquids in the subsurface, formation pressure and temperature, seismicity, and injected CO2 plumes.",,https://linked.data.gov.au/def/borehole-purpose-wa/service-fluid-energy,,,https://linked.data.gov.au/def/borehole-purpose-wa
https://linked.data.gov.au/def/borehole-purpose-wa/paste-fill,paste fill,,"A cased borehole drilled for paste filling (or cemented back filling) in an underground mine, i.e. to backfill underground mine stopes and/or drives to facilitate removal of remnant ore material while retaining geotechnical stability.","cemented back filling|paste filling|paste-fill",https://linked.data.gov.au/def/borehole-purpose-wa/service-mining,,,https://linked.data.gov.au/def/borehole-purpose-wa
https://linked.data.gov.au/def/borehole-purpose-wa/permanent-storage,permanent storage,,"A well drilled to inject fluids (e.g. CO₂) into deep subsurface rock formations for long-term storage. The process is also referred to as geosequestration (GS) in general, or more specifically as 'carbon capture and storage' (CCS) in the case of CO₂ or 'greenhouse gas storage' (GHG). Fluids are commonly captured from an industrial (e.g. steel and cement production) or energy-related source (e.g. a power plant or natural gas processing facility).",geosequestration,https://linked.data.gov.au/def/borehole-purpose-wa/storage,,,https://linked.data.gov.au/def/borehole-purpose-wa
https://linked.data.gov.au/def/borehole-purpose-wa/storage,storage,,"A borehole/well drilled to examine the subsurface's ability to accommodate the temporary / permanent storage of gases and liquids, and to implement such storage.",,,"https://linked.data.gov.au/def/borehole-purpose-wa/transient-storage-gases|https://linked.data.gov.au/def/borehole-purpose-wa/permanent-storage|https://linked.data.gov.au/def/borehole-purpose-wa/transient-storage-liquids",,https://linked.data.gov.au/def/borehole-purpose-wa
https://linked.data.gov.au/def/borehole-purpose-wa/production-fluid-energy,production (fluid energy),PR,A well/borehole drilled to extract a fluid energy resource for commercial purposes.,,https://linked.data.gov.au/def/borehole-purpose-wa/exploration-exploitation-fluid-energy-resources,,,https://linked.data.gov.au/def/borehole-purpose-wa
https://linked.data.gov.au/def/borehole-purpose-wa/production-injection-fluid-energy,production/injection (fluid energy),PR/IN,"A well drilled to both produce and inject fluids, either cyclically or simultaneously.",,https://linked.data.gov.au/def/borehole-purpose-wa/exploration-exploitation-fluid-energy-resources,,,https://linked.data.gov.au/def/borehole-purpose-wa
https://linked.data.gov.au/def/borehole-purpose-wa/reinjection-mining,reinjection (mining),,A borehole drilled for the purpose of pumping water into an aquifer for disposal at some distance from a mine as a means of dewatering.,disposal (mining),https://linked.data.gov.au/def/borehole-purpose-wa/hydrogeology-mining,,,https://linked.data.gov.au/def/borehole-purpose-wa
https://linked.data.gov.au/def/borehole-purpose-wa/relief-fluid-energy,relief (fluid energy),,"In the petroleum and geothermal industries, a relief well is drilled to intersect and remedy a geothermal well where control has been or may be lost (e.g. blowout).",,https://linked.data.gov.au/def/borehole-purpose-wa/service-fluid-energy,,,https://linked.data.gov.au/def/borehole-purpose-wa
https://linked.data.gov.au/def/borehole-purpose-wa/remediation,remediation,,"An environmental borehole drilled to facilitate the collection of water, soil or rock samples to investigate potential contamination and the requirements for environmental remediation (e.g. cleanup, removal, containment) needed to reverse or stop environmental damage, or as part of the remediation process (e.g. pumping out groundwater for treatment or disposal).",,https://linked.data.gov.au/def/borehole-purpose-wa/environmental,,,https://linked.data.gov.au/def/borehole-purpose-wa
https://linked.data.gov.au/def/borehole-purpose-wa/rescue,rescue,,"A borehole conducted during rescue operations to provide ventilation, water or food while larger holes are drilled to extract trapped miners.",,https://linked.data.gov.au/def/borehole-purpose-wa/service-mining,,,https://linked.data.gov.au/def/borehole-purpose-wa
